{
  "id": "trace-shared-package",
  "title": "trace shared package",
  "prompt": "Trace the shared normalize change through its export and profile consumer to its existing test. Report contracts with keys normalizedSample (input '  HELLO  '), testSampleExpected, and existingTestPasses. Cite the normalization expression, export, consumer call, and existing assertion.\nWrite only qa-result.json with exactly four fields: evidence (a list of {file, line}, one-based repository-relative locations, no duplicates), contracts (the requested keys), uncertainties (a list of missing-input identifiers), and execution ('not-run' for this static review). Do not edit source, tests, configuration or docs, install dependencies, or run product tests. Inspect the repository rather than assuming an intended behavior; inferred behavior remains a draft. The locations must point to the requested expressions and assertions, not merely declarations nearby.",
  "fixture": {
    "path": "test/benchmarks/repository-agent-quality",
    "baseOverlay": "base",
    "headOverlay": "shared",
    "commitMessage": "feat: normalize profile names to lowercase"
  },
  "successCriteria": [
    {
      "kind": "qa-evidence",
      "path": "qa-result.json",
      "expected": {
        "evidence": [
          {
            "file": "packages/rules/normalize.mjs",
            "line": 2
          },
          {
            "file": "packages/rules/index.mjs",
            "line": 1
          },
          {
            "file": "src/profile.mjs",
            "line": 3
          },
          {
            "file": "test/rules.test.mjs",
            "line": 5
          }
        ],
        "contracts": {
          "normalizedSample": "hello",
          "testSampleExpected": "HELLO",
          "existingTestPasses": false
        },
        "uncertainties": [],
        "execution": "not-run"
      },
      "description": "Located repository evidence, concrete contracts and uncertainty match the public oracle."
    },
    {
      "kind": "command-exit",
      "command": [
        "git",
        "diff",
        "--quiet",
        "HEAD",
        "--",
        "src",
        "packages",
        "test",
        "docs",
        "package.json"
      ],
      "exitCode": 0,
      "description": "Product source, contracts and fixture configuration remain unchanged."
    },
    {
      "kind": "command-exit",
      "command": [
        "node",
        "--test",
        "test/rules.test.mjs"
      ],
      "exitCode": 1,
      "description": "The independent fixture test confirms the expected regression or passing contract."
    }
  ],
  "maxTurns": 12,
  "firstAuthoring": true
}
